{
 "currency": "NZD",
 "block": "rates",
 "schema_version": "0.3.0",
 "config_version": "0.4.0",
 "generated_at": "2026-10-14T06:32:52+00:00",
 "as_of": "2026-10-09",
 "equivalence_quality": "high",
 "equivalence_note": "B2 daily close (T-1, 15:00 NZT). Floor system: the overnight interbank rate should sit at/just above the OCR; it is published only on days with trades (sparse) → the daily stress spread is the 30-day bank bill − OCR with a persistence rule, corrected for hike pricing by the 90-day bill and 1-year swap; the OMO price is fixed (OCR + 10) so price stress shows up in ORRF use and bills, not in the operation | v0.2: B2 bank bills are NZFMA/LSEG closing rates (the 10:20 NZT BKBM fixing itself is published by NZFBF; public delayed feed unverified — pending); NZ OIS has no public feed (not available, not proxied)",
 "source_health": {
  "status": "stale",
  "series_loaded": 16,
  "series_expected": 16,
  "last_fetch_ok": true,
  "errors": [
   "rbnz_b2: failed after 3 tries: HTTP 403 (blocked/throttled) for https://www.rbnz.govt.nz/-/media/project/sites/rbnz/files/statistics/series/b/b2/hb2-daily-close.xlsx — HTTP 403 headers={'Server': 'cloudflare', 'CF-RAY': 'a4a489466a6fdd86-IAD'} body=<!DOCTYPE html>\r <html lang=\"en\">\r <head>\r <title>Website unavailable - Reserve Bank of New Zealand - Te Pūtea Matua</title>\r <meta charset=\"utf-8\">\r <meta name",
   "rbnz_d12: failed after 3 tries: HTTP 403 (blocked/throttled) for https://www.rbnz.govt.nz/-/media/project/sites/rbnz/files/statistics/series/d-f-r/d12/hd12.xlsx — HTTP 403 headers={'Server': 'cloudflare', 'CF-RAY': 'a4a489b81e8df5ca-IAD'} body=<!DOCTYPE html>\r <html lang=\"en\">\r <head>\r <title>Website unavailable - Reserve Bank of New Zealand - Te Pūtea Matua</title>\r <meta charset=\"utf-8\">\r <meta name",
   "rbnz_d3: failed after 3 tries: HTTP 403 (blocked/throttled) for https://www.rbnz.govt.nz/-/media/project/sites/rbnz/files/statistics/series/d-f-r/d3/hd3.xlsx — HTTP 403 headers={'Server': 'cloudflare', 'CF-RAY': 'a4a48a29ec376ac7-IAD'} body=<!DOCTYPE html>\r <html lang=\"en\">\r <head>\r <title>Website unavailable - Reserve Bank of New Zealand - Te Pūtea Matua</title>\r <meta charset=\"utf-8\">\r <meta name",
   "rbnz_d9: failed after 3 tries: HTTP 403 (blocked/throttled) for https://www.rbnz.govt.nz/-/media/project/sites/rbnz/files/statistics/series/d/d9/hd9-weekly.xlsx — HTTP 403 headers={'Server': 'cloudflare', 'CF-RAY': 'a4a48a9baebddd86-IAD'} body=<!DOCTYPE html>\r <html lang=\"en\">\r <head>\r <title>Website unavailable - Reserve Bank of New Zealand - Te Pūtea Matua</title>\r <meta charset=\"utf-8\">\r <meta name",
   "nzdm_last_good_copy: NZDM blocked (HTTP 403): served from the committed raw snapshots — nzdm_tbill_listing.html (snapshot 2026-10-14); nzdm_tbill_1892.html (snapshot 2026-10-14); nzdm_bond_listing.html (snapshot 2026-10-14); nzdm_bond_1012.html (snapshot 2026-10-14)"
  ],
  "series_pending": 0,
  "sparse_by_design": [
   "overnight_interbank"
  ]
 },
 "series": {
  "ocr": {
   "source_id": "INM.DP1.N",
   "label": "Official Cash Rate",
   "usd_analog": "Fed funds target",
   "unit": "%",
   "frequency": "daily",
   "status": "stale",
   "value": 2.75,
   "date": "2026-10-07",
   "prev_value": 2.75,
   "prev_date": "2026-10-06",
   "change_abs": 0.0,
   "change_pct": 0.0,
   "zscore": 0.5,
   "percentile": null,
   "window": null,
   "level": "SAFE",
   "sparkline": [
    2.5,
    2.5,
    2.5,
    2.5,
    2.5,
    2.5,
    2.5,
    2.5,
    2.5,
    2.5,
    2.5,
    2.5,
    2.5,
    2.5,
    2.5,
    2.5,
    2.5,
    2.5,
    2.5,
    2.5,
    2.5,
    2.5,
    2.5,
    2.5,
    2.5,
    2.5,
    2.5,
    2.75,
    2.75,
    2.75,
    2.75,
    2.75,
    2.75,
    2.75,
    2.75,
    2.75,
    2.75,
    2.75,
    2.75,
    2.75,
    2.75,
    2.75,
    2.75,
    2.75,
    2.75,
    2.75,
    2.75,
    2.75,
    2.75,
    2.75,
    2.75,
    2.75
   ],
   "high_low": {
    "high": 2.75,
    "high_date": "2026-09-03",
    "low": 2.5,
    "low_date": "2026-07-28"
   },
   "age_days": 7,
   "confidence": 85,
   "latest_outlier": false
  },
  "odr": {
   "source_id": "INM.DD1.N",
   "label": "Overnight Deposit Rate (floor = OCR)",
   "usd_analog": "IORB",
   "unit": "%",
   "frequency": "daily",
   "status": "stale",
   "value": 2.75,
   "date": "2026-10-07",
   "prev_value": 2.75,
   "prev_date": "2026-10-06",
   "change_abs": 0.0,
   "change_pct": 0.0,
   "zscore": 0.5,
   "percentile": null,
   "window": null,
   "level": "SAFE",
   "sparkline": [
    2.5,
    2.5,
    2.5,
    2.5,
    2.5,
    2.5,
    2.5,
    2.5,
    2.5,
    2.5,
    2.5,
    2.5,
    2.5,
    2.5,
    2.5,
    2.5,
    2.5,
    2.5,
    2.5,
    2.5,
    2.5,
    2.5,
    2.5,
    2.5,
    2.5,
    2.5,
    2.5,
    2.75,
    2.75,
    2.75,
    2.75,
    2.75,
    2.75,
    2.75,
    2.75,
    2.75,
    2.75,
    2.75,
    2.75,
    2.75,
    2.75,
    2.75,
    2.75,
    2.75,
    2.75,
    2.75,
    2.75,
    2.75,
    2.75,
    2.75,
    2.75,
    2.75
   ],
   "high_low": {
    "high": 2.75,
    "high_date": "2026-09-03",
    "low": 2.5,
    "low_date": "2026-07-28"
   },
   "age_days": 7,
   "confidence": 85,
   "latest_outlier": false
  },
  "orrf_rate": {
   "source_id": "INM.DD2.N",
   "label": "Overnight Reverse Repurchase Facility rate (ceiling = OCR + 0.50)",
   "usd_analog": "SRF rate",
   "unit": "%",
   "frequency": "daily",
   "status": "stale",
   "value": 3.25,
   "date": "2026-10-07",
   "prev_value": 3.25,
   "prev_date": "2026-10-06",
   "change_abs": 0.0,
   "change_pct": 0.0,
   "zscore": 0.5,
   "percentile": null,
   "window": null,
   "level": "SAFE",
   "sparkline": [
    3.0,
    3.0,
    3.0,
    3.0,
    3.0,
    3.0,
    3.0,
    3.0,
    3.0,
    3.0,
    3.0,
    3.0,
    3.0,
    3.0,
    3.0,
    3.0,
    3.0,
    3.0,
    3.0,
    3.0,
    3.0,
    3.0,
    3.0,
    3.0,
    3.0,
    3.0,
    3.0,
    3.25,
    3.25,
    3.25,
    3.25,
    3.25,
    3.25,
    3.25,
    3.25,
    3.25,
    3.25,
    3.25,
    3.25,
    3.25,
    3.25,
    3.25,
    3.25,
    3.25,
    3.25,
    3.25,
    3.25,
    3.25,
    3.25,
    3.25,
    3.25,
    3.25
   ],
   "high_low": {
    "high": 3.25,
    "high_date": "2026-09-03",
    "low": 3.0,
    "low_date": "2026-07-28"
   },
   "age_days": 7,
   "confidence": 85,
   "latest_outlier": false
  },
  "overnight_interbank": {
   "source_id": "INM.DN.NZK",
   "label": "Overnight interbank cash rate (sparse — days with trades only)",
   "usd_analog": "EFFR",
   "unit": "%",
   "frequency": "daily",
   "status": "fresh",
   "value": 2.84,
   "date": "2026-10-01",
   "prev_value": 2.8,
   "prev_date": "2026-09-29",
   "change_abs": 0.04,
   "change_pct": 1.4286,
   "zscore": 1.7269,
   "percentile": null,
   "window": null,
   "level": "SAFE",
   "sparkline": [
    2.29,
    2.28,
    2.3,
    2.28,
    2.3,
    2.31,
    2.36,
    2.34,
    2.34,
    2.29,
    2.33,
    2.34,
    2.35,
    2.34,
    2.33,
    2.31,
    2.32,
    2.32,
    2.33,
    2.35,
    2.32,
    2.35,
    2.33,
    2.32,
    2.3,
    2.31,
    2.3,
    2.31,
    2.31,
    2.3,
    2.3,
    2.28,
    2.31,
    2.3,
    2.33,
    2.33,
    2.3,
    2.31,
    2.75,
    2.63,
    2.57,
    2.57,
    2.58,
    2.58,
    2.57,
    2.83,
    2.79,
    2.85,
    2.83,
    2.78,
    2.8,
    2.84
   ],
   "high_low": {
    "high": 2.85,
    "high_date": "2026-09-11",
    "low": 2.28,
    "low_date": "2026-03-20"
   },
   "age_days": 13,
   "confidence": 70,
   "latest_outlier": false,
   "equivalence_note": "published only on days with trades (sparse) — last 2026-10-01"
  },
  "bank_bill_30d": {
   "source_id": "INM.DB01.NZZV",
   "label": "Bank bill yield 30 days",
   "usd_analog": null,
   "unit": "%",
   "frequency": "daily",
   "status": "stale",
   "value": 2.99,
   "date": "2026-10-07",
   "prev_value": 3.0,
   "prev_date": "2026-10-06",
   "change_abs": -0.01,
   "change_pct": -0.3333,
   "zscore": 0.8218,
   "percentile": null,
   "window": null,
   "level": "SAFE",
   "sparkline": [
    2.7,
    2.7,
    2.7,
    2.7,
    2.71,
    2.71,
    2.73,
    2.74,
    2.73,
    2.75,
    2.76,
    2.78,
    2.78,
    2.78,
    2.8,
    2.81,
    2.83,
    2.83,
    2.84,
    2.86,
    2.87,
    2.88,
    2.89,
    2.9,
    2.92,
    2.93,
    2.94,
    2.95,
    2.95,
    2.95,
    2.95,
    2.95,
    2.95,
    2.95,
    2.95,
    2.95,
    2.95,
    2.95,
    2.95,
    2.95,
    2.97,
    2.98,
    2.99,
    3.0,
    3.01,
    3.01,
    3.02,
    3.0,
    3.0,
    3.02,
    3.0,
    2.99
   ],
   "high_low": {
    "high": 3.02,
    "high_date": "2026-09-30",
    "low": 2.7,
    "low_date": "2026-07-28"
   },
   "age_days": 7,
   "confidence": 85,
   "latest_outlier": false
  },
  "bank_bill_60d": {
   "source_id": "INM.DB02.NZZV",
   "label": "Bank bill yield 60 days",
   "usd_analog": null,
   "unit": "%",
   "frequency": "daily",
   "status": "stale",
   "value": 3.11,
   "date": "2026-10-07",
   "prev_value": 3.12,
   "prev_date": "2026-10-06",
   "change_abs": -0.01,
   "change_pct": -0.3205,
   "zscore": 1.1797,
   "percentile": null,
   "window": null,
   "level": "SAFE",
   "sparkline": [
    2.81,
    2.81,
    2.82,
    2.82,
    2.83,
    2.82,
    2.83,
    2.83,
    2.83,
    2.85,
    2.85,
    2.87,
    2.87,
    2.87,
    2.89,
    2.9,
    2.91,
    2.91,
    2.92,
    2.94,
    2.94,
    2.95,
    2.96,
    2.98,
    2.99,
    3.0,
    3.01,
    3.0,
    3.0,
    3.0,
    3.0,
    3.0,
    3.0,
    3.02,
    3.04,
    3.04,
    3.05,
    3.05,
    3.06,
    3.06,
    3.07,
    3.09,
    3.1,
    3.11,
    3.12,
    3.12,
    3.12,
    3.11,
    3.11,
    3.12,
    3.12,
    3.11
   ],
   "high_low": {
    "high": 3.12,
    "high_date": "2026-09-28",
    "low": 2.81,
    "low_date": "2026-07-28"
   },
   "age_days": 7,
   "confidence": 85,
   "latest_outlier": false
  },
  "bank_bill_90d": {
   "source_id": "INM.DB03.NZZV",
   "label": "Bank bill yield 90 days (BKBM)",